{
  "overlay": "S2c",
  "description": "Light rail on the Option A alignment - the retained harbour-side former railway strip. The route with plurality public support that was not selected.",
  "applies_to": {
    "scenario": [
      "S2c"
    ]
  },
  "set": {
    "A.lightrail.dwell_charging_s": 20.0,
    "A.lightrail.tsp_enabled": false,
    "A.signals.scats_phasing": "proxy_no_priority"
  }
}
